{
  "contract": "WeeklyLedger",
  "schemaVersion": "1.1.0",
  "hashAlgorithm": "sha256",
  "projectionDigestVersion": "1.0.0",
  "projectionDigestAlgorithm": "sha256",
  "entries": [
    {
      "projectId": "project-history",
      "campaignId": "campaign-history",
      "weekStart": "2026-06-01",
      "revision": 1,
      "weeklyPanelId": "weekly-panel:history:2026-06-01:r1",
      "schemaVersion": "1.0.0",
      "canonicalHash": "3333333333333333333333333333333333333333333333333333333333333333",
      "projectionDigest": "140912763cfc8b5e6fc256be84216b79a6e85e761654bc717452ef18f74bf749",
      "metrics": [{
        "name": "roas",
        "value": 2.1,
        "seal": "Estimado",
        "sourceRef": { "kind": "platform-export", "id": "week-1" },
        "attributionWindow": "7d_click_1d_view",
        "premiseRef": { "kind": "assumption", "id": "platform-attribution" },
        "confirmedByHuman": true,
        "cashConfirmed": false
      }]
    },
    {
      "projectId": "project-history",
      "campaignId": "campaign-history",
      "weekStart": "2026-06-08",
      "revision": 1,
      "weeklyPanelId": "weekly-panel:history:2026-06-08:r1",
      "schemaVersion": "1.0.0",
      "canonicalHash": "4444444444444444444444444444444444444444444444444444444444444444",
      "projectionDigest": "598aa567cb4eb546db932df4052931672a414bce3a2bb43c84d98dfff8e3c377",
      "metrics": [{
        "name": "roas",
        "value": 2.4,
        "seal": "Estimado",
        "sourceRef": { "kind": "platform-export", "id": "week-2" },
        "attributionWindow": "1d_click",
        "premiseRef": { "kind": "assumption", "id": "platform-attribution" },
        "confirmedByHuman": true,
        "cashConfirmed": false
      }]
    }
  ],
  "index": [
    { "projectId": "project-history", "campaignId": "campaign-history", "weekStart": "2026-06-01", "revisions": [{ "revision": 1, "entryIndex": 0 }] },
    { "projectId": "project-history", "campaignId": "campaign-history", "weekStart": "2026-06-08", "revisions": [{ "revision": 1, "entryIndex": 1 }] }
  ]
}
